{
    "process": {
        "name": "Sammanställ mätningsunderlag för postal enkät",
        "parentState": "Sammanställ mätningsunderlag"
    },
    "hsaId": "SE2321000131-E000000000001",    
    "dn": "o=Västra Götalandsregionen,st=Västra regionen,c=Sverige",
    "measurement": {
        "name": "Primärvård 2015",
        "grouping": "Primärvård",
        "period": "2015"
    },
    "open": "2015-05-01",
    "close": "2015-07-01",
    "currentState": "Godkänn sammanställning"
}